{
  "$schema": "http://json-schema.org/draft-07/schema#",
  "$id": "https://vibe-tracing/schemas/architecture_constraints.schema.json",
  "title": "ArchitectureConstraints",
  "description": "Schema for the Vibe Tracing architecture_constraints.json file.",
  "type": "object",
  "required": [
    "schema_version",
    "project"
  ],
  "additionalProperties": true,
  "properties": {
    "schema_version": {
      "type": "string"
    },
    "project": {
      "type": "object",
      "required": ["project_id", "name", "stage"],
      "additionalProperties": true,
      "properties": {
        "project_id": {
          "type": "string",
          "pattern": "^[A-Z0-9_-]+$"
        },
        "name": {
          "type": "string"
        },
        "description": {
          "type": "string"
        },
        "stage": {
          "type": "string"
        }
      }
    },
    "architecture_principles": {
      "type": "array",
      "items": {
        "type": "object",
        "required": ["principle_id", "title", "description", "severity"],
        "additionalProperties": true,
        "properties": {
          "principle_id": {
            "type": "string",
            "pattern": "^[A-Z0-9_-]+$"
          },
          "title": {
            "type": "string"
          },
          "description": {
            "type": "string"
          },
          "severity": {
            "type": "string",
            "enum": ["must", "should", "could"]
          },
          "related_requirements": {
            "type": "array",
            "items": {
              "type": "string",
              "pattern": "^[A-Z0-9_-]+$"
            }
          }
        }
      }
    },
    "module_boundaries": {
      "type": "array",
      "items": {
        "type": "object",
        "required": ["module_id", "name", "responsibility"],
        "additionalProperties": true,
        "properties": {
          "module_id": {
            "type": "string",
            "pattern": "^[A-Z0-9_-]+$"
          },
          "name": {
            "type": "string"
          },
          "responsibility": {
            "type": "string"
          },
          "allowed_to_call": {
            "type": "array",
            "items": {
              "type": "string",
              "pattern": "^[A-Z0-9_-]+$"
            }
          },
          "forbidden_to_call": {
            "type": "array",
            "items": {
              "type": "string",
              "pattern": "^[A-Z0-9_-]+$"
            }
          },
          "owned_data": {
            "type": "array",
            "items": {
              "type": "string"
            }
          },
          "must_not_own_data": {
            "type": "array",
            "items": {
              "type": "string"
            }
          },
          "related_requirements": {
            "type": "array",
            "items": {
              "type": "string",
              "pattern": "^[A-Z0-9_-]+$"
            }
          }
        }
      }
    },
    "dependency_rules": {
      "type": "array",
      "items": {
        "type": "object",
        "required": ["rule_id", "title", "description", "severity"],
        "additionalProperties": true,
        "properties": {
          "rule_id": {
            "type": "string",
            "pattern": "^[A-Z0-9_-]+$"
          },
          "title": {
            "type": "string"
          },
          "description": {
            "type": "string"
          },
          "severity": {
            "type": "string",
            "enum": ["must", "should", "could"]
          },
          "allowed_dependencies": {
            "type": "array",
            "items": {
              "type": "string"
            }
          },
          "forbidden_dependencies": {
            "type": "array",
            "items": {
              "type": "string"
            }
          },
          "rationale": {
            "type": "string"
          },
          "related_modules": {
            "type": "array",
            "items": {
              "type": "string",
              "pattern": "^[A-Z0-9_-]+$"
            }
          }
        }
      }
    },
    "data_flow_rules": {
      "type": "array",
      "items": {
        "type": "object",
        "required": ["rule_id", "title", "description", "severity", "from", "to"],
        "additionalProperties": true,
        "properties": {
          "rule_id": {
            "type": "string",
            "pattern": "^[A-Z0-9_-]+$"
          },
          "title": {
            "type": "string"
          },
          "description": {
            "type": "string"
          },
          "severity": {
            "type": "string",
            "enum": ["must", "should", "could"]
          },
          "from": {
            "type": "string"
          },
          "to": {
            "type": "string"
          },
          "flow_type": {
            "type": "string"
          },
          "transform_rules": {
            "type": "array",
            "items": {
              "type": "string"
            }
          },
          "validation_rules": {
            "type": "array",
            "items": {
              "type": "string"
            }
          },
          "rationale": {
            "type": "string"
          },
          "related_requirements": {
            "type": "array",
            "items": {
              "type": "string",
              "pattern": "^[A-Z0-9_-]+$"
            }
          }
        }
      }
    },
    "storage_rules": {
      "type": "array",
      "items": {
        "type": "object",
        "required": ["rule_id", "title", "description", "severity"],
        "additionalProperties": true,
        "properties": {
          "rule_id": {
            "type": "string",
            "pattern": "^[A-Z0-9_-]+$"
          },
          "title": {
            "type": "string"
          },
          "description": {
            "type": "string"
          },
          "severity": {
            "type": "string",
            "enum": ["must", "should", "could"]
          },
          "data_objects": {
            "type": "array",
            "items": {
              "type": "string"
            }
          },
          "storage_backend": {
            "type": "string"
          },
          "retention": {
            "type": "string"
          },
          "access_pattern": {
            "type": "string"
          },
          "backup_requirement": {
            "type": "string"
          },
          "consistency_requirement": {
            "type": "string"
          },
          "rationale": {
            "type": "string"
          }
        }
      }
    },
    "error_handling_rules": {
      "type": "array",
      "items": {
        "type": "object",
        "required": ["rule_id", "title", "description", "severity"],
        "additionalProperties": true,
        "properties": {
          "rule_id": {
            "type": "string",
            "pattern": "^[A-Z0-9_-]+$"
          },
          "title": {
            "type": "string"
          },
          "description": {
            "type": "string"
          },
          "severity": {
            "type": "string",
            "enum": ["must", "should", "could"]
          },
          "applies_to": {
            "type": "array",
            "items": {
              "type": "string"
            }
          },
          "expected_behavior": {
            "type": "string"
          },
          "forbidden_behavior": {
            "type": "string"
          },
          "recovery_strategy": {
            "type": "string"
          },
          "retry_policy": {
            "type": "string"
          }
        }
      }
    },
    "logging_rules": {
      "type": "array",
      "items": {
        "type": "object",
        "required": ["rule_id", "title", "description", "severity"],
        "additionalProperties": true,
        "properties": {
          "rule_id": {
            "type": "string",
            "pattern": "^[A-Z0-9_-]+$"
          },
          "title": {
            "type": "string"
          },
          "description": {
            "type": "string"
          },
          "severity": {
            "type": "string",
            "enum": ["must", "should", "could"]
          },
          "log_level": {
            "type": "string"
          },
          "output_target": {
            "type": "string"
          },
          "format": {
            "type": "string"
          },
          "required_fields": {
            "type": "array",
            "items": {
              "type": "string"
            }
          },
          "forbidden_fields": {
            "type": "array",
            "items": {
              "type": "string"
            }
          },
          "rate_control": {
            "type": "string"
          }
        }
      }
    },
    "security_rules": {
      "type": "array",
      "items": {
        "type": "object",
        "required": ["rule_id", "title", "description", "severity"],
        "additionalProperties": true,
        "properties": {
          "rule_id": {
            "type": "string",
            "pattern": "^[A-Z0-9_-]+$"
          },
          "title": {
            "type": "string"
          },
          "description": {
            "type": "string"
          },
          "severity": {
            "type": "string",
            "enum": ["must", "should", "could"]
          },
          "applies_to": {
            "type": "array",
            "items": {
              "type": "string"
            }
          },
          "data_classification": {
            "type": "string"
          },
          "encryption_requirement": {
            "type": "string"
          },
          "required_behavior": {
            "type": "string"
          },
          "forbidden_behavior": {
            "type": "string"
          },
          "related_risks": {
            "type": "array",
            "items": {
              "type": "string"
            }
          }
        }
      }
    },
    "technology_constraints": {
      "type": "array",
      "items": {
        "type": "object",
        "required": ["constraint_id", "title", "description", "severity"],
        "additionalProperties": true,
        "properties": {
          "constraint_id": {
            "type": "string",
            "pattern": "^[A-Z0-9_-]+$"
          },
          "title": {
            "type": "string"
          },
          "description": {
            "type": "string"
          },
          "severity": {
            "type": "string",
            "enum": ["must", "should", "could"]
          },
          "allowed": {
            "type": "array",
            "items": {
              "type": "string"
            }
          },
          "forbidden": {
            "type": "array",
            "items": {
              "type": "string"
            }
          },
          "evaluation_criteria": {
            "type": "array",
            "items": {
              "type": "string"
            }
          },
          "rationale": {
            "type": "string"
          }
        }
      }
    },
    "forbidden_patterns": {
      "type": "array",
      "items": {
        "type": "object",
        "required": ["pattern_id", "title", "description", "severity"],
        "additionalProperties": true,
        "properties": {
          "pattern_id": {
            "type": "string",
            "pattern": "^[A-Z0-9_-]+$"
          },
          "title": {
            "type": "string"
          },
          "description": {
            "type": "string"
          },
          "severity": {
            "type": "string",
            "enum": ["must", "should", "could"]
          },
          "examples": {
            "type": "array",
            "items": {
              "type": "string"
            }
          },
          "detection_method": {
            "type": "string"
          },
          "reason": {
            "type": "string"
          }
        }
      }
    },
    "quality_gates": {
      "type": "array",
      "items": {
        "type": "object",
        "required": ["gate_id", "title", "description", "severity"],
        "additionalProperties": true,
        "properties": {
          "gate_id": {
            "type": "string",
            "pattern": "^[A-Z0-9_-]+$"
          },
          "title": {
            "type": "string"
          },
          "description": {
            "type": "string"
          },
          "severity": {
            "type": "string",
            "enum": ["must", "should", "could"]
          },
          "check_type": {
            "type": "string"
          },
          "pass_condition": {
            "type": "string"
          },
          "fail_condition": {
            "type": "string"
          },
          "blocks_merge": {
            "type": "boolean"
          },
          "scope_modules": {
            "type": "array",
            "items": {
              "type": "string"
            }
          },
          "scope_task_types": {
            "type": "array",
            "items": {
              "type": "string"
            }
          }
        }
      }
    },
    "interface_contracts": {
      "type": "array",
      "items": {
        "type": "object",
        "required": ["contract_id", "title", "description"],
        "additionalProperties": true,
        "properties": {
          "contract_id": {
            "type": "string",
            "pattern": "^[A-Z0-9_-]+$"
          },
          "title": {
            "type": "string"
          },
          "description": {
            "type": "string"
          },
          "from_module": {
            "type": "string"
          },
          "to_module": {
            "type": "string"
          },
          "interface_type": {
            "type": "string"
          },
          "method_name": {
            "type": "string"
          },
          "request_format": {
            "type": "string"
          },
          "response_format": {
            "type": "string"
          },
          "error_response_format": {
            "type": "string"
          },
          "rate_limit": {
            "type": "string"
          },
          "versioning_policy": {
            "type": "string"
          }
        }
      }
    },
    "performance_constraints": {
      "type": "array",
      "items": {
        "type": "object",
        "required": ["constraint_id", "title", "description", "severity"],
        "additionalProperties": true,
        "properties": {
          "constraint_id": {
            "type": "string",
            "pattern": "^[A-Z0-9_-]+$"
          },
          "title": {
            "type": "string"
          },
          "description": {
            "type": "string"
          },
          "severity": {
            "type": "string",
            "enum": ["must", "should", "could"]
          },
          "metric": {
            "type": "string"
          },
          "threshold_value": {
            "type": "string"
          },
          "measurement_condition": {
            "type": "string"
          },
          "applies_to": {
            "type": "array",
            "items": {
              "type": "string"
            }
          },
          "violation_consequence": {
            "type": "string"
          }
        }
      }
    },
    "deployment_constraints": {
      "type": "array",
      "items": {
        "type": "object",
        "required": ["constraint_id", "title", "description", "severity"],
        "additionalProperties": true,
        "properties": {
          "constraint_id": {
            "type": "string",
            "pattern": "^[A-Z0-9_-]+$"
          },
          "title": {
            "type": "string"
          },
          "description": {
            "type": "string"
          },
          "severity": {
            "type": "string",
            "enum": ["must", "should", "could"]
          },
          "category": {
            "type": "string"
          },
          "requirement": {
            "type": "string"
          },
          "applies_to": {
            "type": "array",
            "items": {
              "type": "string"
            }
          },
          "verification_method": {
            "type": "string"
          }
        }
      }
    },
    "test_constraints": {
      "type": "array",
      "items": {
        "type": "object",
        "required": ["constraint_id", "title", "description", "severity"],
        "additionalProperties": true,
        "properties": {
          "constraint_id": {
            "type": "string",
            "pattern": "^[A-Z0-9_-]+$"
          },
          "title": {
            "type": "string"
          },
          "description": {
            "type": "string"
          },
          "severity": {
            "type": "string",
            "enum": ["must", "should", "could"]
          },
          "test_level": {
            "type": "string"
          },
          "required_coverage": {
            "type": "string"
          },
          "required_cases": {
            "type": "array",
            "items": {
              "type": "string"
            }
          },
          "forbidden_patterns": {
            "type": "array",
            "items": {
              "type": "string"
            }
          },
          "applies_to": {
            "type": "array",
            "items": {
              "type": "string"
            }
          }
        }
      }
    }
  }
}
