{
  "schema_version": "1.0.0",
  "project": {
    "project_id": "PROJECT-VT",
    "name": "Sample Project",
    "stage": "mvp"
  },
  "module_boundaries": [
    {
      "module_id": "MOD-VT-001",
      "name": "Core Module",
      "responsibility": "Core feature implementation",
      "related_requirements": ["REQ-VT-001"]
    }
  ],
  "architecture_principles": [
    {
      "principle_id": "FORBID-VT-007",
      "title": "静默处理不明确架构约束",
      "severity": "must",
      "description": "当某条架构约束无法自动检查时，系统必须将其标记为 unclear，而不是忽略它。"
    }
  ],
  "dependency_rules": [
    {
      "rule_id": "DEP-VT-001",
      "title": "Core 不得依赖特定 Agent Runtime",
      "severity": "must",
      "description": "Vibe Tracing Core 必须能够在不依赖特定 Agent Runtime 的情况下被调用。"
    },
    {
      "rule_id": "DEP-VT-002",
      "title": "Dashboard 不得依赖外部前端资源",
      "severity": "must",
      "description": "dashboard.html 必须能在任意现代浏览器中直接打开，不得依赖 CDN、npm 构建、后端服务或外部 JSON 文件。"
    }
  ],
  "storage_rules": [
    {
      "rule_id": "STORE-VT-001",
      "title": "MVP 不使用数据库",
      "severity": "must",
      "description": "MVP 必须只使用 file保存输入和输出。"
    }
  ],
  "quality_gates": [
    {
      "gate_id": "GATE-VT-001",
      "title": "必需输入文件必须存在",
      "severity": "must",
      "description": "MVP 分析至少需要 PRD、架构约束、任务列表 and Agent Claim 作为治理输入。"
    },
    {
      "gate_id": "GATE-VT-006",
      "title": "Must 级架构约束不得被违反",
      "severity": "must",
      "description": "Must 级架构约束不得存在已确认违反项。"
    },
    {
      "gate_id": "GATE-VT-007",
      "title": "不明确的 Must 级架构约束必须导致保守门禁",
      "severity": "must",
      "description": "如果 Must 级架构约束无法被检查，系统不得输出完全 allow 的合并结论。"
    },
    {
      "gate_id": "GATE-VT-008",
      "title": "A Must constraint not checked by ArchitectureComplianceChecker",
      "severity": "must",
      "description": "This rule is unchecked by the python code and should be flagged as unclear."
    }
  ]
}